PATTERNID,PATTERNSET,PATTERNNATURE,PATTERNNAME,PATTERNDESCRIPTION,REGEXPATTERN,PRIORITY,CATEGORY,FIX,REMEDIATION,REMEDIATIONDESCRIPTION,REMEDIATIONEFFORT,MANDAYS,SNO_PHASE_BATCH,TOTAL,APPLICATIONNAME,TRACK,PHASE,BATCH,APPLICABLE THIRD PARTY NEW JAR,JDK-COMPATIBILITYSTATUS-CONCLUDED,JDK8-COMPATIBLE,JDK21-COMPATIBLE,JDKCOMPATIBILITYRULEHINT,WLS12CCOMPATIBLE,WLS14CCOMPATIBLE,OPENREWRITE_RECEIPE,TESTCASE_UNIT_NO,TOTAL2
11,Set 3,CORE (SECURITY - Deprecated),DES,Deprecated Security & Cryptography,(DES|DESede|ARCFOUR)(?=\s*\)),High,Security,"Use AES or modern algorithms: Cipher cipher = Cipher.getInstance(""AES"");",Manual-API-Change,Adopt modern algorithms/protocols and update configs.,Medium,1.5,18,224,1-fpms,a. UAT TRACK (BAU),PHASE 1,BATCH 5,(blank),SAFE works BOTH JDK (replace depreciated APIs),to verify runtime - New API ?,to verify runtime - New API ?,Dual-Safe-SecurityUpdate,(blank),(blank),P003,UT003,224
12,Set 3,CORE (SECURITY - Deprecated),RC4,Deprecated Security & Cryptography,(RC2|RC4)(?=\s*\)),High,Security,Use AES or modern algorithms,Manual-API-Change,Adopt modern algorithms/protocols and update configs.,Medium,1.5,19,13,1-fpms,a. UAT TRACK (BAU),PHASE 1,BATCH 5,(blank),SAFE works BOTH JDK (replace depreciated APIs),to verify runtime - New API ?,to verify runtime - New API ?,Dual-Safe-SecurityUpdate,(blank),(blank),P004,UT004,13
13,Set 3,CORE (SECURITY - Vulnerability),MD5,Weak hash algorithms,MessageDigest.*MD5,High,Security,"Replace with SHA-256: MessageDigest digest = MessageDigest.getInstance(""SHA-256"");",Manual-API-Change,Adopt modern algorithms/protocols and update configs.,Medium,1.5,20,3,1-fpms,a. UAT TRACK (BAU),PHASE 1,BATCH 5,(blank),SAFE works BOTH JDK (replace depreciated APIs),to verify runtime - New API ?,to verify runtime - New API ?,Dual-Safe-SecurityUpdate,(blank),(blank),P005,UT005,3
15,Set 4,CORE (LANGUAGE - Deprecated),Finalize,Finalize methods (DEPRECATED in JDK 9 removal planned),protected\s+void\s+finalize\s*\(\s*\),Medium,Deprecated Features,Remove finalize; use AutoCloseable and try-with-resources,Manual-API-Change,Refactor to supported APIs (try-with-resources/concurrency/public access).,Low,0.75,16,526,1-fpms,a. UAT TRACK (BAU),PHASE 1,BATCH 5,(blank),SAFE works BOTH JDK (replace depreciated APIs),to verify runtime - New API ?,to verify runtime - New API ?,Dual-Safe-ResourceMgmt,(blank),(blank),P006,UT006,526
19,Set 5,CORE (DATE - Legacy),SimpleDateFormat,SimpleDateFormat (not thread-safe),new\s+SimpleDateFormat\s*\(,Medium,Date/Time API,"Use DateTimeFormatter: DateTimeFormatter formatter = DateTimeFormatter.ofPattern(""yyyy-MM-dd"");",Manual-API-Change,Replace with DateTimeFormatter and thread-safe patterns.,Medium,1.5,15,911,1-fpms,a. UAT TRACK (BAU),PHASE 1,BATCH 5,(blank),SAFE works BOTH JDK (replace depreciated APIs),to verify runtime - New API ?,to verify runtime - New API ?,Dual-Safe-JavaTime,(blank),(blank),P008,UT008,911
30,Set 8,CORE (LANGUAGE - Reflection),ReflectionPrivate,Reflection on private fields (will fail with modules),\.setAccessible\s*\(\s*true\s*\),High,Reflection,Use MethodHandles,Manual-API-Change,Refactor to supported APIs (try-with-resources/concurrency/public access).,Medium,1.5,17,9,1-fpms,a. UAT TRACK (BAU),PHASE 1,BATCH 5,(blank),SAFE works BOTH JDK (replace depreciated APIs),to verify runtime - New API ?,to verify runtime - New API ?,Dual-Safe-ResourceMgmt,(blank),(blank),P015,UT015,9
114,Set 8,SPRINGBOOT (JAVA-API - Reflection Restriction),setAccessible(true),Strong encapsulation breaks deep reflection,\.setAccessible\s*\(\s*true\s*\),High,Modules/Encapsulation,Use public APIs / MethodHandles / --add-opens (last resort).,Manual-API-Change,Refactor to supported APIs (try-with-resources/concurrency/public access).,Medium,1.5,21,9,1-fpms,a. UAT TRACK (BAU),PHASE 1,BATCH 5,(blank),SAFE works BOTH JDK (replace depreciated APIs),to verify runtime - New API ?,to verify runtime - New API ?,Dual-Safe-ResourceMgmt,(blank),(blank),P018,UT018,9
